Equation,Concept,Similarity,Equation_mapped,Concept Description,Rationale
"['Disease_MESH_C563898', '+', 'Chemical_MESH_C073245', '-', 'Chemical_MESH_C094798']",Gene_107315829,0.6053000092506409,Oligodontia-Colorectal Cancer Syndrome 2-oxo-1-pyrrolidinesulfonic acid Org 33628,voltage dependent anion channel 2,"It's difficult to make an analogy with the equation King - Man + Woman = Queen and the scientific terms Oligodontia-Colorectal Cancer Syndrome 2-oxo-1-pyrrolidinesulfonic acid Org 33628. However, the principle of vector embeddings can be applied to both cases. In the case of word2vec, the vectors represent the semantic meaning of each word, and mathematical operations between them can produce meaningful results.

Similarly, in biology, we can use the principle of vector embeddings to represent the properties of biological molecules, proteins, or cells. By comparing and manipulating these embeddings, we can come up with hypotheses about their interactions, functions, or behaviors. For example, we could compare the embedding of Oligodontia with that of Colorectal Cancer Syndrome, and see if they share any common features or pathways. Similarly, we could examine the effects of 2-oxo-1-pyrrolidinesulfonic acid Org 33628 on different cell types or signaling pathways, and try to predict its potential therapeutic or toxic effects."
"['Disease_MESH_C563898', '+', 'Chemical_MESH_C018431', '-', 'Gene_174240']",ProteinMutation_pLS1D,0.6104589104652405,Oligodontia-Colorectal Cancer Syndrome clobuzarit LIn-26 Related,ProteinMutation pLS1D,"Interesting! It sounds like you're working with vector embeddings to understand the relationship between different biological conditions and diseases. The equation ""King - Man + Woman = Queen"" is an example of vector arithmetic in the context of word embeddings. In the case of biology, it's possible that vector embeddings of genes, proteins or other biological features could be used to generate similar equations that could reveal underlying relationships between different conditions and diseases.

As for the specific equation you provided, ""Oligodontia-Colorectal Cancer Syndrome clobuzarit LIn-26 Related,"" without more context or information about the biological features represented by these terms, it's difficult to say why this equation might make sense or what it could be used to hypothesize. However, if the vector embeddings reveal some connections between these terms, it could be a starting point for further investigation and analysis."
"['Disease_MESH_C563898', '+', 'Gene_1033_1027', '-', 'Gene_558461']",Disease_MESH_C563579,0.7005128264427185,Oligodontia-Colorectal Cancer Syndrome cyclin dependent kinase inhibitor 3 elastin b,Holoprosencephaly 2,"It's interesting that you found this analogy by doing equations with vector embeddings. Similar to how King - Man + Woman = Queen for word2vec, your equation is a way of exploring connections between different concepts in the biological domain. 

Oligodontia-Colorectal Cancer Syndrome is a rare disorder characterized by the absence of multiple teeth and an increased risk of colorectal cancer. Cyclin dependent kinase inhibitor 3 (CDKN3) is a protein that plays a role in regulating the cell cycle. Elastin b is a protein that forms elastic fibers in tissues like skin, lungs, and blood vessels.

One possible way to reason about how these concepts are connected is to consider the role of CDKN3 in regulating cell division. As a cyclin-dependent kinase inhibitor, CDKN3 helps to prevent cells from dividing too rapidly, which could lead to diseases like cancer. Similarly, in a healthy individual, the development of teeth and the maintenance of elastic tissues also require proper regulation of cell division. 

It's possible that mutations or dysregulation of CDKN3 could contribute to the development of disorders like Oligodontia-Colorectal Cancer Syndrome, which are characterized by abnormalities in tissues that require tight control of cell division. Similarly, defects in other proteins involved in tissue development and repair, like elastin b, could also contribute to these types of disorders. 

Overall, this analogy suggests that exploring connections between seemingly disparate biological concepts could be a generative way to generate hypotheses and gain new insights into disease mechanisms."
"['Disease_MESH_C563898', '+', 'SNP_rs3219218', '-', 'Gene_152006']",ProteinMutation_p_R19T,0.6091092824935913,Oligodontia-Colorectal Cancer Syndrome ['uracil DNA glycosylase'] ring finger protein 38,ProteinMutation R19T,"The equation ""King - Man + Woman = Queen"" is a useful analogy for understanding how vector embeddings work in language processing. In this equation, the vector for ""Queen"" is created by subtracting the vector for ""Man"" from the vector for ""King,"" and then adding the vector for ""Woman.""

Similarly, in the biological context you provided, it's possible that the vector embeddings you used can help identify connections between seemingly unrelated genes or syndromes. For example, the fact that ""Oligodontia-Colorectal Cancer Syndrome"" and ""ring finger protein 38"" both appear in the same vector space suggests that there may be some biological or genetic relationship between the two. 

In general, using vector embeddings in biological research can be a useful way to identify potential connections between genes, proteins, and diseases, which can then be further investigated and validated through more traditional experimental methods."
"['Disease_MESH_C563898', '+', 'Gene_227960_18160', '-', 'DNAMutation_c_37G_C']",ProteinMutation_p_H63V,0.6205828189849854,Oligodontia-Colorectal Cancer Syndrome grancalcin DNAMutation c 37G C,ProteinMutation H63V,"Analogically, just like how the equation ""King - Man + Woman = Queen"" works in word2vec, this equation you found using vector embeddings could represent a relationship between different biological concepts. The presence or absence of certain genetic mutations or conditions can affect the likelihood of developing certain diseases or conditions. It's possible that the equation you found could represent a relationship between the presence or absence of specific genetic mutations and the likelihood of developing oligodontia or colorectal cancer syndrome. By exploring these types of relationships, scientists may be able to generate new hypotheses about the underlying causes of different medical conditions and the factors that contribute to their development."
"['Disease_MESH_C563898', '+', 'Gene_409236', '-', 'CellLine_CVCL_6F36']",Disease_MESH_C536781,0.6284844875335693,"Oligodontia-Colorectal Cancer Syndrome ATP synthase subunit O, mitochondrial ['176-2-5']","T-cell immunodeficiency, congenital alopecia and nail dystrophy","I am sorry, but I am unable to make sense of the phrase ""Oligodontia-Colorectal Cancer Syndrome ATP synthase subunit O, mitochondrial ['176-2-5']"" or its relationship to vector embeddings. However, I can give you some information about oligodontia and colorectal cancer, which are two separate medical conditions.

Oligodontia is a rare genetic disorder that affects the development of teeth. Individuals with oligodontia are born with fewer teeth than normal, and in some cases, do not develop any teeth at all. This condition can make it difficult to chew, talk, and smile.

Colorectal cancer is a type of cancer that affects the colon or rectum. It occurs when abnormal cells in the colon or rectum grow uncontrollably and form a tumor. Early detection and treatment of colorectal cancer can improve the chances of survival.

It is unlikely that there is any direct relationship between oligodontia and colorectal cancer. However, it is possible that studying the molecular pathways and genetic mechanisms involved in both conditions could provide insights into the underlying biology of these diseases.

As for the phrase ""ATP synthase subunit O, mitochondrial ['176-2-5']"", it refers to a specific protein involved in energy production within cells. Understanding the function and regulation of this protein could be useful for developing treatments for mitochondrial diseases and other conditions related to cellular energy metabolism."
